{
  "$schema": "https://json-schema.org/draft/2020-12/schema",
  "$id": "https://goobers.dev/schemas/diagnostics.schema.json",
  "title": "DiagnosticsEnvelope",
  "description": "Machine-readable findings emitted by goobers validate and goobers lint.",
  "type": "object",
  "additionalProperties": false,
  "required": ["schemaVersion", "version", "commit", "ok", "counts", "findings"],
  "properties": {
    "schemaVersion": { "const": "goobers.dev/diagnostics/v1" },
    "version": { "type": "string", "minLength": 1 },
    "commit": { "type": "string", "minLength": 1 },
    "ok": { "type": "boolean" },
    "counts": {
      "type": "object",
      "additionalProperties": false,
      "required": ["errors", "warnings"],
      "properties": {
        "errors": { "type": "integer", "minimum": 0 },
        "warnings": { "type": "integer", "minimum": 0 },
        "infos": { "description": "Number of informational findings.", "type": "integer", "minimum": 0 }
      }
    },
    "findings": {
      "type": "array",
      "items": { "$ref": "#/$defs/finding" }
    }
  },
  "$defs": {
    "finding": {
      "type": "object",
      "additionalProperties": false,
      "required": ["file", "code", "severity", "message"],
      "properties": {
        "file": { "type": "string", "minLength": 1 },
        "line": { "type": "integer", "minimum": 1 },
        "col": { "type": "integer", "minimum": 1 },
        "path": { "type": "string", "pattern": "^/" },
        "code": { "type": "string", "minLength": 1 },
        "severity": { "type": "string", "enum": ["error", "warning", "info"] },
        "message": { "type": "string", "minLength": 1 },
        "safety": {
          "description": "Additive warning-only workflow safety analysis; never affects execution.",
          "type": "object",
          "additionalProperties": false,
          "required": ["version", "id", "gaggle", "workflow", "stage", "witnessPath", "confidence", "coverage", "impact", "action", "limitations"],
          "properties": {
            "version": { "const": "goobers.dev/workflow-safety/v1" },
            "id": { "type": "string", "pattern": "^[a-f0-9]{64}$" },
            "gaggle": { "type": "string" },
            "workflow": { "type": "string" },
            "stage": { "type": "string" },
            "file": { "type": "string" },
            "line": { "type": "integer", "minimum": 1 },
            "col": { "type": "integer", "minimum": 1 },
            "witnessPath": { "type": "array", "items": { "type": "string" } },
            "confidence": { "type": "string", "enum": ["high", "uncertain", "unknown"] },
            "coverage": { "type": "string", "enum": ["modeled", "partial", "incomplete"] },
            "impact": { "type": "string" },
            "action": { "type": "string" },
            "limitations": { "type": "string" },
            "budget": { "type": "integer", "minimum": 1 },
            "budgetSource": { "type": "string" },
            "suppressedCode": { "type": "string" },
            "suppressionReason": { "type": "string" }
          }
        }
      },
      "anyOf": [
        { "required": ["line", "col"] },
        { "required": ["path"] }
      ]
    }
  }
}
