{
  "schemaVersion": "goobers.dev/diagnostics/v1",
  "version": "dev",
  "commit": "none",
  "ok": true,
  "counts": {
    "errors": 0,
    "warnings": 3
  },
  "findings": [
    {
      "file": "config/gaggles/example/workflows/default-implement.yaml",
      "line": 56,
      "col": 13,
      "path": "/",
      "code": "SAF006",
      "severity": "warning",
      "message": "workflow \"example\"/\"default-implement\" stage \"open-pr\": custom command or agent effects are unknown Path: query-backlog -\u003e implement -\u003e push-branch -\u003e open-pr. Impact: Evidence production, subject changes and publication by this stage are not proven. Action: Declare a narrowly scoped safety contract if this stage supplies an obligation, or inspect it manually. Confidence: unknown; coverage: partial. Static wiring only, not live delivery or a proof of safety; custom declarations are author assertions. Source: gaggles/example/workflows/default-implement.yaml:56:13. Advisory only; the workflow remains enabled.",
      "safety": {
        "version": "goobers.dev/workflow-safety/v1",
        "id": "6202231b18adad8a7d0147276b9a928574df51825365709649db183c3cd6ba9b",
        "gaggle": "example",
        "workflow": "default-implement",
        "stage": "open-pr",
        "file": "gaggles/example/workflows/default-implement.yaml",
        "line": 56,
        "col": 13,
        "witnessPath": [
          "query-backlog",
          "implement",
          "push-branch",
          "open-pr"
        ],
        "confidence": "unknown",
        "coverage": "partial",
        "impact": "Evidence production, subject changes and publication by this stage are not proven.",
        "action": "Declare a narrowly scoped safety contract if this stage supplies an obligation, or inspect it manually.",
        "limitations": "Static wiring only, not live delivery or a proof of safety; custom declarations are author assertions."
      }
    },
    {
      "file": "config/gaggles/example/gaggle.yaml",
      "path": "/",
      "code": "PLACEHOLDER001",
      "severity": "warning",
      "message": "contains unedited template marker(s) your-org, your-repo; replace them with the target repository coordinates"
    },
    {
      "file": "instance.yaml",
      "path": "/",
      "code": "PLACEHOLDER001",
      "severity": "warning",
      "message": "contains unedited template marker(s) your-org, your-repo; replace them with the target repository coordinates"
    }
  ]
}
